{
  "generatedAt": "2026-08-05T23:24:59Z",
  "pointOfInterestCategories": [
    {
      "categoryId": "cultural-activity",
      "pointOfInterestId": "poi-arena-cultural-k86"
    },
    {
      "categoryId": "exhibitor",
      "pointOfInterestId": "poi-cabana-vermelha-k28"
    },
    {
      "categoryId": "entity",
      "pointOfInterestId": "poi-influenciadores-by-skeelo-k24"
    },
    {
      "categoryId": "entity",
      "pointOfInterestId": "poi-espaco-bem-estar-k32"
    },
    {
      "categoryId": "entity",
      "pointOfInterestId": "poi-estudio-podcast-k26"
    },
    {
      "categoryId": "infrastructure",
      "pointOfInterestId": "poi-infrastructure-marker-01"
    },
    {
      "categoryId": "exhibitor",
      "pointOfInterestId": "poi-guarderia-souvenirs-k75"
    },
    {
      "categoryId": "exhibitor",
      "pointOfInterestId": "poi-estudio-ton-47"
    },
    {
      "categoryId": "infrastructure",
      "pointOfInterestId": "poi-infrastructure-marker-02"
    },
    {
      "categoryId": "infrastructure",
      "pointOfInterestId": "poi-infrastructure-marker-03"
    },
    {
      "categoryId": "cultural-activity",
      "pointOfInterestId": "poi-convidado-de-honra-espanha-e40"
    },
    {
      "categoryId": "infrastructure",
      "pointOfInterestId": "poi-infrastructure-marker-04"
    },
    {
      "categoryId": "cultural-activity",
      "pointOfInterestId": "poi-autografos-1-2-e-3-dd20"
    },
    {
      "categoryId": "cultural-activity",
      "pointOfInterestId": "poi-praca-da-palavra-d28"
    },
    {
      "categoryId": "cultural-activity",
      "pointOfInterestId": "poi-cordel-e-repente-dd10"
    },
    {
      "categoryId": "cultural-activity",
      "pointOfInterestId": "poi-espaco-infantil-c88"
    },
    {
      "categoryId": "cultural-activity",
      "pointOfInterestId": "poi-salao-de-ideias-c40"
    },
    {
      "categoryId": "infrastructure",
      "pointOfInterestId": "poi-infrastructure-marker-05"
    },
    {
      "categoryId": "infrastructure",
      "pointOfInterestId": "poi-infrastructure-marker-06"
    },
    {
      "categoryId": "infrastructure",
      "pointOfInterestId": "poi-infrastructure-marker-07"
    },
    {
      "categoryId": "infrastructure",
      "pointOfInterestId": "poi-infrastructure-marker-08"
    },
    {
      "categoryId": "infrastructure",
      "pointOfInterestId": "poi-infrastructure-marker-09"
    },
    {
      "categoryId": "cultural-activity",
      "pointOfInterestId": "poi-praca-da-palavra-a61"
    },
    {
      "categoryId": "infrastructure",
      "pointOfInterestId": "poi-infrastructure-marker-10"
    },
    {
      "categoryId": "infrastructure",
      "pointOfInterestId": "poi-infrastructure-marker-11"
    },
    {
      "categoryId": "infrastructure",
      "pointOfInterestId": "poi-loja-oficial-a73"
    },
    {
      "categoryId": "infrastructure",
      "pointOfInterestId": "poi-loja-oficial-a71"
    },
    {
      "categoryId": "entity",
      "pointOfInterestId": "poi-auditorio-a39"
    }
  ],
  "schemaVersion": "1.0.0",
  "source": {
    "file": "BIL26-0526.pdf",
    "page": 1,
    "type": "pdf-map"
  },
  "standCategories": [
    {
      "categoryId": "exhibitor",
      "standId": "stand-k68"
    },
    {
      "categoryId": "cultural-activity",
      "standId": "stand-k86"
    },
    {
      "categoryId": "exhibitor",
      "standId": "stand-k58"
    },
    {
      "categoryId": "food",
      "standId": "stand-k56"
    },
    {
      "categoryId": "exhibitor",
      "standId": "stand-k28"
    },
    {
      "categoryId": "entity",
      "standId": "stand-k24"
    },
    {
      "categoryId": "food",
      "standId": "stand-k20"
    },
    {
      "categoryId": "food",
      "standId": "stand-k76"
    },
    {
      "categoryId": "exhibitor",
      "standId": "stand-k70"
    },
    {
      "categoryId": "entity",
      "standId": "stand-k42"
    },
    {
      "categoryId": "entity",
      "standId": "stand-k38"
    },
    {
      "categoryId": "entity",
      "standId": "stand-k32"
    },
    {
      "categoryId": "infrastructure",
      "standId": "stand-k30"
    },
    {
      "categoryId": "exhibitor",
      "standId": "stand-k66"
    },
    {
      "categoryId": "entity",
      "standId": "stand-k54"
    },
    {
      "categoryId": "entity",
      "standId": "stand-k26"
    },
    {
      "categoryId": "exhibitor",
      "standId": "stand-k74"
    },
    {
      "categoryId": "exhibitor",
      "standId": "stand-k40"
    },
    {
      "categoryId": "exhibitor",
      "standId": "stand-j28"
    },
    {
      "categoryId": "exhibitor",
      "standId": "stand-j26"
    },
    {
      "categoryId": "exhibitor",
      "standId": "stand-j20"
    },
    {
      "categoryId": "exhibitor",
      "standId": "stand-j86"
    },
    {
      "categoryId": "exhibitor",
      "standId": "stand-k77"
    },
    {
      "categoryId": "exhibitor",
      "standId": "stand-k75"
    },
    {
      "categoryId": "exhibitor",
      "standId": "stand-j70"
    },
    {
      "categoryId": "exhibitor",
      "standId": "stand-j68"
    },
    {
      "categoryId": "exhibitor",
      "standId": "stand-k67"
    },
    {
      "categoryId": "exhibitor",
      "standId": "stand-j60"
    },
    {
      "categoryId": "exhibitor",
      "standId": "stand-j58"
    },
    {
      "categoryId": "exhibitor",
      "standId": "stand-k51"
    },
    {
      "categoryId": "exhibitor",
      "standId": "stand-k45"
    },
    {
      "categoryId": "exhibitor",
      "standId": "stand-k43"
    },
    {
      "categoryId": "exhibitor",
      "standId": "stand-j40"
    },
    {
      "categoryId": "exhibitor",
      "standId": "stand-j38"
    },
    {
      "categoryId": "exhibitor",
      "standId": "stand-k37"
    },
    {
      "categoryId": "exhibitor",
      "standId": "stand-k35"
    },
    {
      "categoryId": "exhibitor",
      "standId": "stand-k33"
    },
    {
      "categoryId": "exhibitor",
      "standId": "stand-j30"
    },
    {
      "categoryId": "exhibitor",
      "standId": "stand-j80"
    },
    {
      "categoryId": "exhibitor",
      "standId": "stand-j76"
    },
    {
      "categoryId": "exhibitor",
      "standId": "stand-j74"
    },
    {
      "categoryId": "exhibitor",
      "standId": "stand-j66"
    },
    {
      "categoryId": "exhibitor",
      "standId": "stand-j52"
    },
    {
      "categoryId": "exhibitor",
      "standId": "stand-j48"
    },
    {
      "categoryId": "exhibitor",
      "standId": "stand-j44"
    },
    {
      "categoryId": "exhibitor",
      "standId": "stand-j36"
    },
    {
      "categoryId": "exhibitor",
      "standId": "stand-j32"
    },
    {
      "categoryId": "exhibitor",
      "standId": "stand-travessa-01"
    },
    {
      "categoryId": "exhibitor",
      "standId": "stand-travessa-02"
    },
    {
      "categoryId": "entity",
      "standId": "stand-travessa-03"
    },
    {
      "categoryId": "exhibitor",
      "standId": "stand-travessa-04"
    },
    {
      "categoryId": "entity",
      "standId": "stand-travessa-05"
    },
    {
      "categoryId": "exhibitor",
      "standId": "stand-travessa-06"
    },
    {
      "categoryId": "exhibitor",
      "standId": "stand-travessa-07"
    },
    {
      "categoryId": "exhibitor",
      "standId": "stand-travessa-08"
    },
    {
      "categoryId": "exhibitor",
      "standId": "stand-travessa-09"
    },
    {
      "categoryId": "exhibitor",
      "standId": "stand-travessa-10"
    },
    {
      "categoryId": "exhibitor",
      "standId": "stand-travessa-11"
    },
    {
      "categoryId": "exhibitor",
      "standId": "stand-travessa-12"
    },
    {
      "categoryId": "exhibitor",
      "standId": "stand-travessa-14"
    },
    {
      "categoryId": "exhibitor",
      "standId": "stand-travessa-15"
    },
    {
      "categoryId": "exhibitor",
      "standId": "stand-travessa-16"
    },
    {
      "categoryId": "exhibitor",
      "standId": "stand-travessa-17"
    },
    {
      "categoryId": "exhibitor",
      "standId": "stand-travessa-18"
    },
    {
      "categoryId": "exhibitor",
      "standId": "stand-travessa-19"
    },
    {
      "categoryId": "entity",
      "standId": "stand-travessa-20"
    },
    {
      "categoryId": "exhibitor",
      "standId": "stand-travessa-21"
    },
    {
      "categoryId": "cultural-activity",
      "standId": "stand-travessa-22"
    },
    {
      "categoryId": "cultural-activity",
      "standId": "stand-travessa-23"
    },
    {
      "categoryId": "exhibitor",
      "standId": "stand-travessa-24"
    },
    {
      "categoryId": "exhibitor",
      "standId": "stand-h86"
    },
    {
      "categoryId": "exhibitor",
      "standId": "stand-j81"
    },
    {
      "categoryId": "exhibitor",
      "standId": "stand-j79"
    },
    {
      "categoryId": "exhibitor",
      "standId": "stand-j75"
    },
    {
      "categoryId": "exhibitor",
      "standId": "stand-h70"
    },
    {
      "categoryId": "exhibitor",
      "standId": "stand-h60"
    },
    {
      "categoryId": "exhibitor",
      "standId": "stand-h58"
    },
    {
      "categoryId": "exhibitor",
      "standId": "stand-h50"
    },
    {
      "categoryId": "exhibitor",
      "standId": "stand-h48"
    },
    {
      "categoryId": "exhibitor",
      "standId": "stand-h40"
    },
    {
      "categoryId": "exhibitor",
      "standId": "stand-h38"
    },
    {
      "categoryId": "exhibitor",
      "standId": "stand-j34"
    },
    {
      "categoryId": "exhibitor",
      "standId": "stand-j33"
    },
    {
      "categoryId": "entity",
      "standId": "stand-h30"
    },
    {
      "categoryId": "exhibitor",
      "standId": "stand-travessa-25"
    },
    {
      "categoryId": "exhibitor",
      "standId": "stand-travessa-26"
    },
    {
      "categoryId": "exhibitor",
      "standId": "stand-travessa-27"
    },
    {
      "categoryId": "exhibitor",
      "standId": "stand-travessa-28"
    },
    {